{
  "counts": {
    "conditions": 44,
    "domainClasses": 19,
    "groups": 13,
    "guidelineVersions": 1,
    "guidelines": 1,
    "items": 42,
    "requirements": 220,
    "rules": 60,
    "scopes": 17,
    "sections": 6,
    "sources": 4,
    "topics": 29
  },
  "files": [
    {
      "id": "consort-2025-item-1a",
      "item_number": "1a",
      "order": 1,
      "path": "Items/CONSORT 1a.md"
    },
    {
      "id": "consort-2025-item-1b",
      "item_number": "1b",
      "order": 2,
      "path": "Items/CONSORT 1b.md"
    },
    {
      "id": "consort-2025-item-2",
      "item_number": "2",
      "order": 3,
      "path": "Items/CONSORT 2.md"
    },
    {
      "id": "consort-2025-item-3",
      "item_number": "3",
      "order": 4,
      "path": "Items/CONSORT 3.md"
    },
    {
      "id": "consort-2025-item-4",
      "item_number": "4",
      "order": 5,
      "path": "Items/CONSORT 4.md"
    },
    {
      "id": "consort-2025-item-5a",
      "item_number": "5a",
      "order": 6,
      "path": "Items/CONSORT 5a.md"
    },
    {
      "id": "consort-2025-item-5b",
      "item_number": "5b",
      "order": 7,
      "path": "Items/CONSORT 5b.md"
    },
    {
      "id": "consort-2025-item-6",
      "item_number": "6",
      "order": 8,
      "path": "Items/CONSORT 6.md"
    },
    {
      "id": "consort-2025-item-7",
      "item_number": "7",
      "order": 9,
      "path": "Items/CONSORT 7.md"
    },
    {
      "id": "consort-2025-item-8",
      "item_number": "8",
      "order": 10,
      "path": "Items/CONSORT 8.md"
    },
    {
      "id": "consort-2025-item-9",
      "item_number": "9",
      "order": 11,
      "path": "Items/CONSORT 9.md"
    },
    {
      "id": "consort-2025-item-10",
      "item_number": "10",
      "order": 12,
      "path": "Items/CONSORT 10.md"
    },
    {
      "id": "consort-2025-item-11",
      "item_number": "11",
      "order": 13,
      "path": "Items/CONSORT 11.md"
    },
    {
      "id": "consort-2025-item-12a",
      "item_number": "12a",
      "order": 14,
      "path": "Items/CONSORT 12a.md"
    },
    {
      "id": "consort-2025-item-12b",
      "item_number": "12b",
      "order": 15,
      "path": "Items/CONSORT 12b.md"
    },
    {
      "id": "consort-2025-item-13",
      "item_number": "13",
      "order": 16,
      "path": "Items/CONSORT 13.md"
    },
    {
      "id": "consort-2025-item-14",
      "item_number": "14",
      "order": 17,
      "path": "Items/CONSORT 14.md"
    },
    {
      "id": "consort-2025-item-15",
      "item_number": "15",
      "order": 18,
      "path": "Items/CONSORT 15.md"
    },
    {
      "id": "consort-2025-item-16a",
      "item_number": "16a",
      "order": 19,
      "path": "Items/CONSORT 16a.md"
    },
    {
      "id": "consort-2025-item-16b",
      "item_number": "16b",
      "order": 20,
      "path": "Items/CONSORT 16b.md"
    },
    {
      "id": "consort-2025-item-17a",
      "item_number": "17a",
      "order": 21,
      "path": "Items/CONSORT 17a.md"
    },
    {
      "id": "consort-2025-item-17b",
      "item_number": "17b",
      "order": 22,
      "path": "Items/CONSORT 17b.md"
    },
    {
      "id": "consort-2025-item-18",
      "item_number": "18",
      "order": 23,
      "path": "Items/CONSORT 18.md"
    },
    {
      "id": "consort-2025-item-19",
      "item_number": "19",
      "order": 24,
      "path": "Items/CONSORT 19.md"
    },
    {
      "id": "consort-2025-item-20a",
      "item_number": "20a",
      "order": 25,
      "path": "Items/CONSORT 20a.md"
    },
    {
      "id": "consort-2025-item-20b",
      "item_number": "20b",
      "order": 26,
      "path": "Items/CONSORT 20b.md"
    },
    {
      "id": "consort-2025-item-21a",
      "item_number": "21a",
      "order": 27,
      "path": "Items/CONSORT 21a.md"
    },
    {
      "id": "consort-2025-item-21b",
      "item_number": "21b",
      "order": 28,
      "path": "Items/CONSORT 21b.md"
    },
    {
      "id": "consort-2025-item-21c",
      "item_number": "21c",
      "order": 29,
      "path": "Items/CONSORT 21c.md"
    },
    {
      "id": "consort-2025-item-21d",
      "item_number": "21d",
      "order": 30,
      "path": "Items/CONSORT 21d.md"
    },
    {
      "id": "consort-2025-item-22a",
      "item_number": "22a",
      "order": 31,
      "path": "Items/CONSORT 22a.md"
    },
    {
      "id": "consort-2025-item-22b",
      "item_number": "22b",
      "order": 32,
      "path": "Items/CONSORT 22b.md"
    },
    {
      "id": "consort-2025-item-23a",
      "item_number": "23a",
      "order": 33,
      "path": "Items/CONSORT 23a.md"
    },
    {
      "id": "consort-2025-item-23b",
      "item_number": "23b",
      "order": 34,
      "path": "Items/CONSORT 23b.md"
    },
    {
      "id": "consort-2025-item-24a",
      "item_number": "24a",
      "order": 35,
      "path": "Items/CONSORT 24a.md"
    },
    {
      "id": "consort-2025-item-24b",
      "item_number": "24b",
      "order": 36,
      "path": "Items/CONSORT 24b.md"
    },
    {
      "id": "consort-2025-item-25",
      "item_number": "25",
      "order": 37,
      "path": "Items/CONSORT 25.md"
    },
    {
      "id": "consort-2025-item-26",
      "item_number": "26",
      "order": 38,
      "path": "Items/CONSORT 26.md"
    },
    {
      "id": "consort-2025-item-27",
      "item_number": "27",
      "order": 39,
      "path": "Items/CONSORT 27.md"
    },
    {
      "id": "consort-2025-item-28",
      "item_number": "28",
      "order": 40,
      "path": "Items/CONSORT 28.md"
    },
    {
      "id": "consort-2025-item-29",
      "item_number": "29",
      "order": 41,
      "path": "Items/CONSORT 29.md"
    },
    {
      "id": "consort-2025-item-30",
      "item_number": "30",
      "order": 42,
      "path": "Items/CONSORT 30.md"
    }
  ],
  "guideline": "consort-2025",
  "requiredLeafItems": [
    "1a",
    "1b",
    "2",
    "3",
    "4",
    "5a",
    "5b",
    "6",
    "7",
    "8",
    "9",
    "10",
    "11",
    "12a",
    "12b",
    "13",
    "14",
    "15",
    "16a",
    "16b",
    "17a",
    "17b",
    "18",
    "19",
    "20a",
    "20b",
    "21a",
    "21b",
    "21c",
    "21d",
    "22a",
    "22b",
    "23a",
    "23b",
    "24a",
    "24b",
    "25",
    "26",
    "27",
    "28",
    "29",
    "30"
  ],
  "schemaVersion": "1.0"
}
